Title1,Text,,,,,
A New App Allows Readers in China to Bypass Censorship of The Intercept,"Since June, people in China have been unable to read The Intercept, after the country’s government apparently banned our website, along with those of several other media organizations. Today, we are happy to announce a workaround that will allow people in China to circumvent the restrictions, access our full site, and continue to read our award-winning journalism.
",,,,,
The Trump Administration Is Using the Full Power of the U.S. Surveillance State Against Whistleblowers,,,,,,
We Tested Europe’s New Lie Detector for Travelers — and Immediately Triggered a False Positive,"THEY CALL IT the Silent Talker. It is a virtual policeman designed to strengthen Europe’s borders, subjecting travelers to a lie detector test before they are allowed to pass through customs.

Prior to your arrival at the airport, using your own computer, you log on to a website, upload an image of your passport, and are greeted by an avatar of a brown-haired man wearing a navy blue uniform.

“What is your surname?” he asks. “What is your citizenship and the purpose of your trip?” You provide your answers verbally to those and other questions, and the virtual policeman uses your webcam to scan your face and eye movements for signs of lying.

At the end of the interview, the system provides you with a QR code that you have to show to a guard when you arrive at the border. The guard scans the code using a handheld tablet device, takes your fingerprints, and reviews the facial image captured by the avatar to check if it corresponds with your passport. The guard’s tablet displays a score out of 100, telling him whether the machine has judged you to be truthful or not.

A person judged to have tried to deceive the system is categorized as “high risk” or “medium risk,” dependent on the number of questions they are found to have falsely answered. Our reporter — the first journalist to test the system before crossing the Serbian-Hungarian border earlier this year — provided honest responses to all questions but was deemed to be a liar by the machine, with four false answers out of 16 and a score of 48. The Hungarian policeman who assessed our reporter’s lie detector results said the system suggested that she should be subject to further checks, though these were not carried out.

Travelers who are deemed dangerous can be denied entry, though in most cases they would never know if the avatar test had contributed to such a decision. The results of the test are not usually disclosed to the traveler; The Intercept obtained a copy of our reporter’s test only after filing a data access request under European privacy laws.",,,,,
Google Continues Investments in Military and Police AI Technology Through Venture Capital Arm,"LAST YEAR,GOOGLE faced internal revolt from many employees over its handling of Project Maven, a secretive contract between the company and the Department of Defense to use artificial intelligence to improve the military’s drone targeting capabilities. After a series of internal, worker-led protests and resignations following reporting by The Intercept and Gizmodo, the company said it would wind down the drone project and promised a more transparent approach to similar work in the future.

Now, a number of Google workers are voicing concerns that the Mountain View, California-based search giant is continuing to deploy cutting-edge AI technology to the Pentagon and law enforcement customers.",,,,,
Voices,,,,,,
"Before Being Hacked, Border Surveillance Firm Lobbied to Downplay Security and Privacy Concerns About Its Technology",,,,,,
Middle East Dictators Buy Spy Tech From Company Linked to IBM and Google,"IT IS THE size of a small suitcase and can be placed discreetly in the back of a car. When the device is powered up, it begins secretly monitoring hundreds of cellphones in the vicinity, recording people’s private conversations and vacuuming up their text messages.

The device is one of several spy tools manufactured by a Chinese company called Semptian, which has supplied the equipment to authoritarian governments in the Middle East and North Africa, according to two sources with knowledge of the company’s operations.

As The Intercept first reported on Thursday, since 2015, Semptian has been using American technology to help build more powerful surveillance and censorship equipment, which it sells to governments under the guise of a front company called iNext.",,,,,
How U.S. Tech Giants Are Helping to Build China’s Surveillance State,"AN AMERICAN ORGANIZATION founded by tech giants Google and IBM is working with a company that is helping China’s authoritarian government conduct mass surveillance against its citizens, The Intercept can reveal.

The OpenPower Foundation — a nonprofit led by Google and IBM executives with the aim of trying to “drive innovation” — has set up a collaboration between IBM, Chinese company Semptian, and U.S. chip manufacturer Xilinx. Together, they have worked to advance a breed of microprocessors that enable computers to analyze vast amounts of data more efficiently.

Shenzhen-based Semptian is using the devices to enhance the capabilities of internet surveillance and censorship technology it provides to human rights-abusing security agencies in China, according to sources and documents. A company employee said that its technology is being used to covertly monitor the internet activity of 200 million people.

Semptian, Google, and Xilinx did not respond to requests for comment. The OpenPower Foundation said in a statement that it “does not become involved, or seek to be informed, about the individual business strategies, goals or activities of its members,” due to antitrust and competition laws. An IBM spokesperson said that his company “has not worked with Semptian on joint technology development,” but declined to answer further questions. A source familiar with Semptian’s operations said that Semptian had worked with IBM through a collaborative cloud platform called SuperVessel, which is maintained by an IBM research unit in China.",,,,,
"Hacked Border Surveillance Firm Wants To Profile Drivers, Passengers, and Their “Likely Trip Purpose” In New York City","JUST MONTHS BEFORE millions of its internal documents were stolen and dumped on the internet, the Tennessee-based surveillance company Perceptics was preparing to pitch New York’s transit authority on how it could help enforce impending “congestion pricing” rules, according to leaked documents reviewed by The Intercept. The pitch, as outlined in the files, went well beyond mere toll enforcement and into profiling New Yorkers’ travel patterns and companions, creating what experts describe as major privacy risks.

Congestion pricing, on the face of it, doesn’t seem like it would present a privacy risk — it’s a traffic policy, after all, not some new NYPD initiative. The plan is to essentially tax the cars that clog Manhattan’s streets and route the proceeds to public transportation, providing both a deterrent against and palliative for traffic. There won’t be any congestion pricing toll booths: The fee will be assessed automatically and electronically, potentially by photographing the license plates of passing cars and sending the plate owner a bill in the mail. This requires cameras running around the clock, dutifully recording every car that comes and goes. And this, Perceptics claims, is where the company truly shines.

According to an internal presentation released by the Perceptics hacker and reviewed by The Intercept, the company pitched New York’s Metropolitan Transportation Authority, or MTA, in February of this year on how Perceptics’ car-scanning camera arrays, already deployed and honed in areas like the Mexican border and an assortment of U.S. military installations, could help the MTA track down drivers. It’s unknown how the plan was received by the MTA, which administers public transit, bridges, and tolls for New York City and some of its surrounding suburbs, but leaked Perceptics emails show that the company shipped camera hardware to the MTA’s Bridges and Tunnels division for a live demonstration.

Perceptics did not respond to a request for comment. An MTA spokesperson told The Intercept that “all details are still to be determined” regarding congestion pricing enforcement.

The presentation document, titled “Smart Imaging Solutions for New York City Congestion Pricing,” makes clear that Perceptics wants to “produce vehicle-specific profiles” using cameras and “unique machine learning algorithms,” allowing the city to immediately recognize and build travel histories of every car in the congestion zone. Law enforcement and surveillance experts said the system described goes far beyond what would ever be necessary to mail scofflaws traffic tickets. Instead, it is an entirely new sort of surveillance apparatus that tracks deeply personal information like “customer travel patterns and travel consistency,” the number of passengers in the car, or “likely trip purpose,” and associates this information with a unique fingerprint of every vehicle that passes by Perceptics’ cameras.

Allie Bohm, a policy counsel with the New York Civil Liberties Union, described the Perceptics plan as an “incredibly privacy-invasive proposal” that “raises all sorts of associational and First Amendment concerns.” Bohm expressed particular alarm about the possibility of a congestion pricing enforcement system eventually feeding data into the NYPD’s existing surveillance regime. “The NYPD has fancied itself an intelligence agency for a very long time,” said Bohm. “These are folks who are pioneering some really, at best, questionable, and, at worst, alarming programs of surveillance and of drawing conclusions from innocuous behavior.”

The MTA will not deploy congestion pricing before 2021 and has yet to select a tolling vendor. But whether Perceptics wins a contract or not, its idea to bring to the heart of Manhattan military-grade surveillance technology — already provided to Saudi Special Forces and the Jordanian army, according to a Perceptics document — is an example of how something as innocuous-sounding as congestion pricing can turn into a surveillance sprawl.",,,,,
"In Court, Facebook Blames Users for Destroying Their Own Right to Privacy","IN APRIL 2018, Facebook CEO Mark Zuckerberg sat before members of both houses of Congress and told them his company respected the privacy of the roughly two billion people who use it. “Privacy” remained largely undefined throughout Zuckerberg’s televised flagellations, but he mentioned the concept more than two dozen times, including when he told the Senate’s Judiciary and Commerce committees, “We have a broader responsibility to protect people’s privacy even beyond” a consent decree from federal privacy regulators, and when he told the House Energy and Commerce Committee, “We believe that everyone around the world deserves good privacy controls.” A year later, Zuckerberg claimed in interviews and essays to have discovered the religion of personal privacy and vowed to rebuild the company in its image.

But only months after Zuckerberg first outlined his “privacy-focused vision for social networking” in a 3,000-word post on the social network he founded, his lawyers were explaining to a California judge that privacy on Facebook is nonexistent.

The courtroom debate, first reported by Law360, took place as Facebook tried to scuttle litigation from users upset that their personal data was shared without their knowledge with the consultancy Cambridge Analytica and later with advisers to Donald Trump’s campaign. The full transcript of the proceedings — which has been quoted from only briefly — reveal one of the most stunning examples of corporate doublespeak certainly in Facebook’s history.

Representing Facebook before U.S. District Judge Vince Chhabria was Orin Snyder of Gibson Dunn & Crutcher, who claimed that the plaintiffs’ charges of privacy invasion were invalid because Facebook users have no expectation of privacy on Facebook. The simple act of using Facebook, Snyder claimed, negated any user’s expectation of privacy:

There is no privacy interest, because by sharing with a hundred friends on a social media platform, which is an affirmative social act to publish, to disclose, to share ostensibly private information with a hundred people, you have just, under centuries of common law, under the judgment of Congress, under the SCA, negated any reasonable expectation of privacy.

An outside party can’t violate what you yourself destroyed, Snyder seemed to suggest. Snyder was emphatic in his description of Facebook as a sort of privacy anti-matter, going so far as to claim that “the social act of broadcasting your private information to 100 people negates, as a matter of law, any reasonable expectation of privacy.” You’d be hard-pressed to come up with a more elegant, concise description of Facebook than “the social act of broadcasting your private information” to people. So not only is it Facebook’s legal position that you’re not entitled to any expectation of privacy, but it’s your fault that the expectation went poof the moment you started using the site (or at least once you connected with 100 Facebook “friends”).

Judge Chhabria was skeptical of Snyder’s privacy nonexistence argument at times, which he rejected as treating personal privacy as a binary, “like either you have a full expectation of privacy, or you have no expectation of privacy at all,” the judge put it at one point. Chhabria continued with a relatable hypothetical:

If I share [information] with ten people, that doesn’t eliminate my expectation of privacy. It might diminish it, but it doesn’t eliminate it. And if I share something with ten people on the understanding that the entity that is helping me share it will not further disseminate it to a thousand companies, I don’t understand why I don’t have — why that’s not a violation of my expectation of privacy.

Snyder responded with an incredible metaphor for how Facebook sees your use of its services — legally, at least:

Let me give you a hypothetical of my own. I go into a classroom and invite a hundred friends. This courtroom. I invite a hundred friends, I rent out the courtroom, and I have a party. And I disclose — And I disclose something private about myself to a hundred people, friends and colleagues. Those friends then rent out a 100,000-person arena, and they rebroadcast those to 100,000 people. I have no cause of action because by going to a hundred people and saying my private truths, I have negated any reasonable expectation of privacy, because the case law is clear.

And there it is, in broad daylight: Using Facebook is a depressing party taking place in a courtroom, for some reason, that’s being simultaneously broadcasted to a 100,000-person arena on a sort of time delay. If you show up at the party, don’t be mad when your photo winds up on the Jumbotron. That is literally the company’s legal position.

Again and again, Snyder blames the targets of surveillance capitalism for their own surveillance:

This is why every parent says to their child, “Do not post it on Facebook if you don’t want to read about it tomorrow morning in the school newspaper,” or, as I tell my young associates if I were going to be giving them an orientation, “Do not put anything on social media that you don’t want to read in the Law Journal in the morning.” There is no expectation of privacy when you go on a social media platform, the purpose of which, when you are set to friends, is to share and communicate things with a large group of people, a hundred people.

At one point Chhabria asked, seemingly unable to believe Snyder’s argument himself, “If Facebook promises not to disseminate anything that you send to your hundred friends, and Facebook breaks that promise and disseminates your photographs to a thousand corporations, that would not be a serious privacy invasion?

Snyder didn’t blink: “Facebook does not consider that to be actionable, as a matter of law under California law.”

Facebook’s counsel did seem to concede one possibility for the existence of privacy on Facebook: someone who uses Facebook completely contrary to the way it’s designed and to the way it has always been marketed. “If you really want to be private,” Snyder proposed to the court, “there are people who have archival Facebook pages that are like their own private mausoleum. It’s only set to [be visible by] me, and it’s for the purpose of repository, you know, of your private information, and no one will ever see that.” So these are your possible valid legal statuses as a Facebook user: You’re either plugged into the 100,0000-person perpetual surveillance Coachella or living in a digital “mausoleum.” But if you ever decide to fling open the doors of your private data crypt and, say, share a little content on Facebook with friends, as the company has been pushing us for the past 13 years, Snyder says you’re out of luck:

Once you go to friends, the gig is over because you’ve just gone — taken a hundred people and pronounced your personal likes and dislikes. In fact, the very act of liking something and showing your friends that you like something is a non-private act. It’s the whole premise of Facebook and social media, is to render not private your likes, your dislikes, your expressions. When I tag someone in a photo, it’s to tell people, not keep private, that I’m sitting on a park bench with John Smith. So it’s the opposite of private when you do that.

Facebook’s stance that if one truly wants to keep something private, they should keep it far from Facebook is odd — odder, still, given the fact that the company publishes an extremely detailed privacy policy, perhaps only meant for those huddling in private mausoleums where such a principle still exists.

“Facebook was built to bring people closer together,” reads the start of the company’s “Privacy Principles.” “We help you connect with friends and family, discover local events and find groups to join.” Not mentioned is that if you do any of that, it’s Facebook’s official opinion that you’ve “negated” your claim to any privacy whatsoever. The list of principles reads like a bad joke after studying Snyder’s courtroom theorizing: “We design privacy into our products from the outset” seems hard to reconcile with “Once you go to friends, the gig is over.” It’s similarly hard to take “We give you control of your privacy” seriously after hearing, through Snyder, that because Facebook users “shared the information … you’ve lost control over the information and its subsequent disclosure.”",,,,,
Team of American Hackers and Emirati Spies Discussed Attacking The Intercept,"OPERATIVES AT A controversial cybersecurity firm working for the United Arab Emirates government discussed targeting The Intercept and breaching the computers of its employees, according to two sources, including a member of the hacking team who said they were present at a meeting to plan for such an attack.

The firm, DarkMatter, brought ex-National Security Agency hackers and other U.S. intelligence and military veterans together with Emirati analysts to compromise the computers of political dissidents at home and abroad, including American citizens, Reuters revealed in January. The news agency also reported that the FBI is investigating DarkMatter’s use of American hacking expertise and the possibility that it was wielded against Americans.

The campaign against dissidents and critics of the Emirati government, code-named Project Raven, began in Baltimore. A 2016 Intercept article by reporter Jenna McLaughlin revealed how the Maryland-based computer security firm CyberPoint assembled a team of Americans for a contract to hone UAE’s budding hacking and surveillance capabilities, leaving some recruits unsettled. Much of the CyberPoint team was later poached by DarkMatter, a firm with close ties to the Emirati government and headquartered just two floors from the Emirati equivalent of the NSA, the National Electronic Security Authority (which later became the Signals Intelligence Agency). One of McLaughlin’s sources described the episode as something of a “hostile takeover” by the UAE government. A subsequent story by McLaughlin  for Foreign Policy detailed how American spies at DarkMatter had been crucial in building the UAE’s intelligence apparatus. The NESA would go on to become Project Raven’s primary “client,” responsible for handing down groups and organizations to be targeted and compromised.",,,,,
