Title1,Text,,,,,
Google Dragonfly,"THE SECRECY SURROUNDING the work was unheard of at Google. It was not unusual for planned new products to be closely guarded ahead of launch. But this time was different. The objective, code-named Dragonfly, was to build a search engine for China that would censor broad categories of information about human rights, democracy, and peaceful protest.

In February 2017, during one of the first group meetings about Dragonfly at Google’s Mountain View headquarters in California, some of those present were left stunned by what they heard. Senior executives disclosed that the search system’s infrastructure would be reliant upon a Chinese partner company with data centers likely in Beijing or Shanghai.

Locating core parts of the search system on the Chinese mainland meant that people’s search records would be easily accessible to China’s authoritarian government, which has broad surveillance powers that it routinely deploys to target activists, journalists, and political opponents.

Yonatan Zunger, then a 14-year veteran of Google and one of the leading engineers at the company, was among a small group who had been asked to work on Dragonfly. He was present at some of the early meetings and said he pointed out to executives managing the project that Chinese people could be at risk of interrogation or detention if they were found to have used Google to seek out information banned by the government.

Scott Beaumont, Google’s head of operations in China and one of the key architects of Dragonfly, did not view Zunger’s concerns as significant enough to merit a change of course, according to four people who worked on the project. Beaumont and other executives then shut out members of the company’s security and privacy team from key meetings about the search engine, the four people said, and tried to sideline a privacy review of the plan that sought to address potential human rights abuses.

Zunger — who left his position at Google last year — is one of the four people who spoke to The Intercept for this story. He is the first person with direct involvement in Dragonfly to go on the record about the project. The other three who spoke to The Intercept are still employed by Google and agreed to share information on the condition of anonymity because they were not authorized to talk to the media. Their accounts provide extraordinary insight into how Google bosses worked to suppress employee criticism of the censored search engine and reveal deep fractures inside the company over the China plan dating back almost two years.

Google’s leadership considered Dragonfly so sensitive that they would often communicate only verbally about it and would not take written notes during high-level meetings to reduce the paper trail, two sources said. Only a few hundred of Google’s 88,000 workforce were briefed about the censorship plan. Some engineers and other staff who were informed about the project were told that they risked losing their jobs if they dared to discuss it with colleagues who were themselves not working on Dragonfly.

“They [leadership] were determined to prevent leaks about Dragonfly from spreading through the company,” said a current Google employee with knowledge of the project. “Their biggest fear was that internal opposition would slow our operations.”",,,,,
Google Dragonfly,LEIA EM PORTUGUÊS ,,,,,
Google Dragonfly,"AMNESTY INTERNATIONAL HAS announced a new protest campaign calling on Google to cancel its controversial plan to launch a censored search engine in China.

The human rights group on Monday launched a petition against the search engine and said that on Tuesday, it will stage demonstrations outside Google offices in the United States, the United Kingdom, Australia, Canada, Germany, Hong Kong, the Netherlands, and Spain. Google’s plan for China would “irreparably damage internet users’ trust in the tech company,” Amnesty said in statement, and “would set a dangerous precedent for tech companies enabling rights abuses by governments.”

As The Intercept first reported in August, Google secretly developed the censored search engine as part of a project code-named Dragonfly. It was designed to blacklist words and phrases such as “human rights,” “Nobel Prize,” and “student protest.” The search platform would link Chinese users’ search records to their cellphone numbers and share people’s search histories with a Chinese partner company. The search records would in turn be accessible to China’s authoritarian government, which has broad surveillance and data-seizing powers that it routinely uses to identify and arrest activists and critics.

“This is a watershed moment for Google,” said Joe Westby, Amnesty International’s researcher on technology and human rights. “As the world’s No. 1 search engine, it should be fighting for an internet where information is freely accessible to everyone, not backing the Chinese government’s dystopian alternative.”",,,,,
"New Law Could Give U.K. Unconstitutional Access to Americans’ Personal Data, Human Rights Groups Warn","NINE HUMAN RIGHTS and civil liberties organizations sent a letter to the U.S. Justice Department today objecting to a potential agreement between the United States and the United Kingdom that would give British law enforcement broad access to data held by U.S. technology companies.

The possible agreement stems from the Clarifying Lawful Overseas Use of Data Act, or CLOUD Act, for which Justice Department officials have lobbied since 2016 and which President Donald Trump signed into law in March.

In addition to requiring American tech companies to provide data on U.S. citizens when served with a warrant, the CLOUD Act allows for so-called executive agreements between the president and foreign governments. These agreements, the first of which would be with the United Kingdom, would empower foreign law enforcement agencies to order U.S. tech companies to produce data about individual users without a warrant, so long as the search target is not a U.S. citizen or resident.

The Electronic Frontier Foundation, one of the organizations that signed the letter of protest, has described a possible scenario for how a U.K. police service might obtain data under the CLOUD Act: “London investigators want the private Slack messages of a Londoner they suspect of bank fraud. The London police could go directly to Slack, a U.S. company, to request and collect those messages. The London police would receive no prior judicial review for this request. The London police could avoid notifying U.S. law enforcement about this request. The London police would not need a probable cause warrant for this collection.”

But this form of international data-sharing could put Americans’ privacy at risk and expose citizens to potential Fourth Amendment abuses, critics say.

While the CLOUD Act requires that foreign police services not “intentionally target a United States person or a person located in the United States,” the law does not stop foreign police agencies from receiving communications of U.S. citizens or residents. Using the Electronic Frontier Foundation’s example of a Londoner communicating on Slack, any communications between the targeted British citizen and Americans would also be turned over to London police.

“The phrase ‘intentionally target’ creates a large loophole; people in the U.S. and U.S. persons overseas could easily get caught in the dragnet,” said Sarah St.Vincent, an investigator with Human Rights Watch, another signatory to the Justice Department letter. Although such so-called minimization procedures are ostensibly in place to prevent foreign governments from ensnaring U.S. users, St.Vincent told The Intercept that she rejects the notion that they “should be reassuring to anyone,” as “procedures are not laws,” but rather safeguards. “I don’t see any mechanism in here to ensure that those are strictly applied and inspected,” St.Vincent added.

The CLOUD Act also leaves open the possibility that a foreign police agency could obtain, without a warrant, incriminating communications from a U.S. citizen, which could then be shared with U.S. law enforcement. Data obtained in this way could not be used as evidence in a U.S. court, because its collection would violate Fourth Amendment protections. But local, state, or federal law enforcement agencies could reacquire the communications after obtaining a warrant — a controversial law enforcement practice known as “parallel construction.”

Federal law enforcement agencies, including the FBI and the Drug Enforcement Administration, already use parallel construction to launder information acquired from the warrantless wiretapping programs exposed by National Security Agency whistleblower Edward Snowden. In November 2017, The Intercept reported how the FBI used parallel construction to enter information first obtained through the government’s mass surveillance programs into evidence in terrorism trials. In these cases, prosecutors did not disclose to the courts that investigators had obtained the evidence from warrantless surveillance and then re-obtained it using legitimate warrants.

A Human Rights Watch report released in January documented how the DEA set up a unit called the Special Operations Division to receive raw intelligence from the NSA and disseminate leads to field agents. Agents on the ground were instructed to conceal the source of their information and find other ways to justify searches and broader investigations.

“The CLOUD Act would specifically allow the U.K. authorities to pass data belonging to U.S. persons back to the U.S. authorities if it ‘relates to significant harm, or the threat thereof, to the United States or United States persons’ — quite a significant loophole,” St.Vincent said. “The U.S. authorities can’t deliberately set up this end run around the Fourth Amendment themselves, but they’re free to sit back and receive whatever the U.K. sees fit to share.”

DESPITE THE ACT’S worrying implications for user privacy, the American tech vanguard has embraced it. In February, Google, Apple, Facebook, Microsoft, and Oath (formerly Yahoo) wrote to four U.S. senators detailing their support for the legislation, claiming that CLOUD “reflects a growing consensus in favor of protecting Internet users,” and “would be notable progress to protect consumers’ rights and would reduce conflicts of law.” In September, Reuters reported that Apple was building an “online tool” that would allow police around the world to more easily request the company’s user data.

Only after the CLOUD Act was passed did Microsoft, one of the law’s early boosters, address questions of personal privacy and offer assurances that the framework would not be abused. In a September blog post, Microsoft president and top lawyer Brad Smith announced “six principles that have driven, and will continue to drive, our advocacy as governments reform their laws and negotiate international agreements,” including a “universal right” for users to be notified if their data is accessed, and the ability to “challenge unlawful and inappropriate demands for user data.” Even so, Smith’s post states unequivocally that Microsoft believes the “passage of the CLOUD Act created the foundation for a new generation of international agreements that allows governments to engage with each other to create lasting rules to protect privacy.” Other tech firms have simply remained silent.",,,,,
The Dangerous Junk Science of Vocal Risk Assessment,"IS IT POSSIBLE to tell whether someone is a criminal just from looking at their face or listening to the sound of their voice? The idea may seem ludicrous, like something out of science fiction — Big Brother in “1984” detects any unconscious look “that carried with it the suggestion of abnormality” — and yet, some companies have recently begun to answer this question in the affirmative. AC Global Risk, a startup founded in 2016, claims to be able to determine your level of “risk” as an employee or an asylum-seeker based not on what you say, but how you say it.

The California-based company offers an automated screening system known as a Remote Risk Assessment, or RRA. Here’s how it works: Clients of AC Global Risk help develop automated, yes-or-no interview questions. The group of people selected for a given screening then answer these simple questions in their native language during a 10-minute interview that can be conducted over the phone. The RRA then measures the characteristics of their voice to produce an evaluation report that scores each individual on a spectrum from low to high risk. CEO Alex Martin has said that the company’s proprietary risk analysis can “forever change for the better how human risk is measured.”

AC Global Risk, which boasts the consulting firm of Robert Gates, Condoleezza Rice, and Stephen Hadley on its advisory board, has advertised contracts with the U.S. Special Operations Command in Afghanistan, the Ugandan Wildlife Authority, and the security teams at Palantir, Apple, Facebook, and Google, among others. The extensive use of risk screening in these and other markets, Martin has said, has proven that it is “highly accurate, scalable, cost-effective, and capable of high throughput.” AC Global Risk claims that its RRA system can simultaneously process hundreds of individuals anywhere in the world. Now, in response to President Donald Trump’s calls for the “extreme vetting” of immigrants, the company has pitched itself as the ultimate solution for “the monumental refugee crisis the U.S. and other countries are currently experiencing.”

It’s a proposal that would seem to appeal to the U.S. Department of Homeland Security. The DHS has already funded research to develop similar AI technology for the border. The program, known as the Automated Virtual Agent for Truth Assessments in Real-Time, or AVATAR, used artificial intelligence to measure changes in the voice, posture, and facial gestures of travelers in order to flag those who appeared untruthful or seemed to pose a potential risk. In 2012 it was tested by volunteers at the U.S.-Mexico border. The European Union has also funded research into technology that would reduce “the workload and subjective errors caused by human agents.”

Some of the leading experts in vocal analytics, algorithmic bias, and machine learning find the trend toward digital polygraph tests troubling, pointing to the faulty methodology of companies like AC Global Risk. “There is some information in dynamic changes in the voice and they’re detecting it. This is perfectly plausible,” explained Alex Todorov, a Princeton University psychologist who studies the science of social perception and first impressions. “But the question is, How unambiguous is this information at detecting the category of people they’ve defined as risky? There is always ambiguity in these kinds of signals.”

Over the past year, the American Civil Liberties Union and others have reported that Border Patrol agents have been seizing people from Greyhound buses based on their appearance or accent. Because Customs and Border Protection agents already use information about how someone speaks or looks as a pretext to search individuals in the 100-mile border zone, or to deny individuals entry to the U.S., experts fear that vocal emotion detection software could make such biases routine, pervasive, and seemingly “objective.”

AC Global Risk declined to respond to repeated requests for comment for this article. The company also did not respond to a list of detailed questions about how the technology works. In public appearances, however, Martin has claimed that the company’s proprietary analytical processes can determine someone’s risk level with greater than 97 percent accuracy. (AVATAR, meanwhile, claims an accuracy rate of between 60 and 70 percent.) Several leading audiovisual experts who reviewed AC Global Risk’s publicly available materials for The Intercept used the word “bullshit” or “bogus” to describe the company’s claims. “From an ethical point of view, it’s very dubious and shady to give the impression that recognizing deception from only the voice can be done with any accuracy,” said Björn Schuller, a professor at the University of Augsburg who has led the field’s major academic challenge event to advance the state of the art in vocal emotion detection. “Anyone who says they can do this should themselves be seen as a risk.”",,,,,
Is It Easier to Imagine the End of the World Than the End of the Internet?,LEIA EM PORTUGUÊS ,,,,,
