Title1,Text,,,,,
What’s really going on with the mail-in ballots the US Postal Service can’t trace ,"Several news outlets reported on Election Day that the United States Postal Service did not have records of delivery scans for 300,000 mail-in ballots across a dozen states, stoking fears that changes to the Postal Service implemented earlier this year by new Postmaster General Louis DeJoy, a top Trump donor, had potentially disenfranchised hundreds of thousands of voters.
But the president of the largest postal worker union corroborated in an interview with Recode on Wednesday morning what the Postal Service has repeatedly said about the data in court filings in recent days: There are numerous reasons why ballots in the days leading up to the election would not receive a delivery scan and that it’s highly unlikely that the number of undelivered ballots totaled anywhere near 300,000.
“Just because something didn’t have [a delivery scan] does not translate at all into ‘it was not delivered,’” Mark Dimondstein, president of the American Postal Workers Union, told Recode on Wednesday. (The APWU has previously been critical of operational changes DeJoy implemented earlier this year — and then put on pause — that its leaders say led to delivery delays.) “What we had in place … is the ballots were given such priority treatment, even beyond first-class treatment, that ballots were being purposely pulled out” of normal mail-processing procedures and given expedited delivery in the days leading up to Election Day.

  
    Related
  

  
    Vox live results: Joe Biden’s path to victory widens
  

Dimondstein outlined various scenarios in which a ballot could be scanned into a facility but not scanned for delivery. The scenarios typically involve ballots not running through a normal automated processing procedure and being hand-sorted to be delivered directly to a Board of Elections facility or to await pickup from the Board of Elections.
“We weren’t worried about the scan,” he added. “We were worried about getting to the Board of Elections on time. Our whole goal is to make it as quick and efficient as possible.”
In a statement Wednesday afternoon, USPS spokesperson Dave Partenheimer said, “The assumption that there are unaccounted ballots within the Postal Service network is inaccurate,” adding that the ballots in question “were delivered in advance of the election deadlines.” He also said ballots delivered directly to local election boards to save time as Election Day approached did not receive a final scan because they didn’t flow through regular mail processing.
But around the same time his statement was issued, a senior USPS official overseeing election mail processing was testifying in federal court on election mail issues, including about the untraced ballots, and said he would have to look into whether any ballots did not make it to their counting destination.
“I wouldn’t be surprised that there were some,” the USPS official, Kevin Bray, said, “[but] I’d be very surprised if they were in the thousands.”
Bray, who was called to testify on short notice earlier in the day, said he hadn’t seen the documents highlighting ballots that were scanned into postal facilities but not scanned out.
Partenheimer did not immediately respond to a question from Recode about why his statement definitively said there were no untraced ballots even as Bray’s remarks left open the possibility that some could have been left behind.
The case of the supposed hundreds of thousands of untraced ballots drew attention on Election Day when a federal judge ordered “all clear” checks of postal facilities in a dozen states that were intended “to ensure that no ballots have been held up and that any identified ballots are immediately sent out for delivery.”
The ordered sweeps included facilities in several swing states including Florida, Arizona, and Michigan, which do not count ballots received after Election Day, and it left open the question of whether some mail-in votes would be disqualified if not delivered by state cutoff times.
US District Judge Emmet Sullivan in Washington, DC, had imposed a 3 pm deadline earlier on Tuesday as part of a lawsuit filed by plaintiffs including the NAACP against the USPS and Postmaster General DeJoy. The suit alleges DeJoy “impeded the timely distribution of mail, implemented crippling policies on postal workers, and sabotaged the United States Postal Service in a blatant attempt to disenfranchise voters of color.” The deadline was also in response to a USPS court filing from Monday indicating that just over 300,000 mail-in ballots nationwide had been scanned upon receipt at mail-processing plants but that there were no records indicating these ballots had been delivered.
Department of Justice lawyers, representing the USPS, responded after the judge’s deadline on Tuesday, saying that regular daily sweeps were conducted in the morning and that the USPS could not move up Election Day facility reviews already scheduled for later in the day, between 4 pm and 8 pm.
On Wednesday, lawyers for the USPS said in a court filing that the Election Day sweeps were carried out and that they turned up just 13 ballots, all in Pennsylvania, that were referred to management for delivery.
At a noon hearing on Wednesday, the judge still scolded USPS leadership for failing to comply with his Tuesday afternoon deadline and threatened that DeJoy may have to testify or be deposed. 
A USPS spokesperson told Recode on Tuesday that since October 29, the US Postal Inspection Service “has been conducting daily reviews at all 220 facilities that process ballots” and that “ballots will continue to be accepted and processed as they are presented to us and we will deliver them to their intended destination.” 
Lawyers for the USPS said in a court filing on Wednesday that postal workers were instructed to run continuous sweeps of their facilities on Election Day and get ballots to their destination by a state’s cutoff time.
“This is super frustrating,” NAACP attorney Allison Zieve told the Washington Post on Tuesday. “If they get all the sweeps done today in time, it doesn’t matter if they flouted the judge’s order. They say here they will get the sweeps done between 4 pm and 8 pm, but 8 pm is too late, and in some states, 5 pm is too late.”
What’s clear is that the 300,000 figure is likely unreliable at best, and perhaps a vast overstatement at worst. What’s still unclear is whether any ballots at all did not make it from a postal facility to a ballot-counting center on time — and it’s not certain that there will be an answer. But there is hope, based on Bray’s testimony on Wednesday, that the USPS will provide more clarity soon.
  
  
  
    Will you help keep Vox free for all?
  
  
    Millions of people rely on Vox to understand how the policy decisions made in Washington, from health care to unemployment to housing, could impact their lives. Our work is well-sourced, research-driven, and in-depth. And that kind of work takes resources. Even after the economy recovers, advertising alone will never be enough to support it. If you have already made a contribution to Vox, thank you. If you haven’t, help us keep our journalism free for everyone by making a financial contribution today, from as little as $3.",,,,,
"No, Joe Biden did not mysteriously gain 138,000 Michigan votes all at once","Several news outlets reported on Election Day that the United States Postal Service did not have records of delivery scans for 300,000 mail-in ballots across a dozen states, stoking fears that changes to the Postal Service implemented earlier this year by new Postmaster General Louis DeJoy, a top Trump donor, had potentially disenfranchised hundreds of thousands of voters.
But the president of the largest postal worker union corroborated in an interview with Recode on Wednesday morning what the Postal Service has repeatedly said about the data in court filings in recent days: There are numerous reasons why ballots in the days leading up to the election would not receive a delivery scan and that it’s highly unlikely that the number of undelivered ballots totaled anywhere near 300,000.
“Just because something didn’t have [a delivery scan] does not translate at all into ‘it was not delivered,’” Mark Dimondstein, president of the American Postal Workers Union, told Recode on Wednesday. (The APWU has previously been critical of operational changes DeJoy implemented earlier this year — and then put on pause — that its leaders say led to delivery delays.) “What we had in place … is the ballots were given such priority treatment, even beyond first-class treatment, that ballots were being purposely pulled out” of normal mail-processing procedures and given expedited delivery in the days leading up to Election Day.

  
    Related
  

  
    Vox live results: Joe Biden’s path to victory widens
  

Dimondstein outlined various scenarios in which a ballot could be scanned into a facility but not scanned for delivery. The scenarios typically involve ballots not running through a normal automated processing procedure and being hand-sorted to be delivered directly to a Board of Elections facility or to await pickup from the Board of Elections.
“We weren’t worried about the scan,” he added. “We were worried about getting to the Board of Elections on time. Our whole goal is to make it as quick and efficient as possible.”
In a statement Wednesday afternoon, USPS spokesperson Dave Partenheimer said, “The assumption that there are unaccounted ballots within the Postal Service network is inaccurate,” adding that the ballots in question “were delivered in advance of the election deadlines.” He also said ballots delivered directly to local election boards to save time as Election Day approached did not receive a final scan because they didn’t flow through regular mail processing.
But around the same time his statement was issued, a senior USPS official overseeing election mail processing was testifying in federal court on election mail issues, including about the untraced ballots, and said he would have to look into whether any ballots did not make it to their counting destination.
“I wouldn’t be surprised that there were some,” the USPS official, Kevin Bray, said, “[but] I’d be very surprised if they were in the thousands.”
Bray, who was called to testify on short notice earlier in the day, said he hadn’t seen the documents highlighting ballots that were scanned into postal facilities but not scanned out.
Partenheimer did not immediately respond to a question from Recode about why his statement definitively said there were no untraced ballots even as Bray’s remarks left open the possibility that some could have been left behind.
The case of the supposed hundreds of thousands of untraced ballots drew attention on Election Day when a federal judge ordered “all clear” checks of postal facilities in a dozen states that were intended “to ensure that no ballots have been held up and that any identified ballots are immediately sent out for delivery.”
The ordered sweeps included facilities in several swing states including Florida, Arizona, and Michigan, which do not count ballots received after Election Day, and it left open the question of whether some mail-in votes would be disqualified if not delivered by state cutoff times.
US District Judge Emmet Sullivan in Washington, DC, had imposed a 3 pm deadline earlier on Tuesday as part of a lawsuit filed by plaintiffs including the NAACP against the USPS and Postmaster General DeJoy. The suit alleges DeJoy “impeded the timely distribution of mail, implemented crippling policies on postal workers, and sabotaged the United States Postal Service in a blatant attempt to disenfranchise voters of color.” The deadline was also in response to a USPS court filing from Monday indicating that just over 300,000 mail-in ballots nationwide had been scanned upon receipt at mail-processing plants but that there were no records indicating these ballots had been delivered.
Department of Justice lawyers, representing the USPS, responded after the judge’s deadline on Tuesday, saying that regular daily sweeps were conducted in the morning and that the USPS could not move up Election Day facility reviews already scheduled for later in the day, between 4 pm and 8 pm.
On Wednesday, lawyers for the USPS said in a court filing that the Election Day sweeps were carried out and that they turned up just 13 ballots, all in Pennsylvania, that were referred to management for delivery.
At a noon hearing on Wednesday, the judge still scolded USPS leadership for failing to comply with his Tuesday afternoon deadline and threatened that DeJoy may have to testify or be deposed. 
A USPS spokesperson told Recode on Tuesday that since October 29, the US Postal Inspection Service “has been conducting daily reviews at all 220 facilities that process ballots” and that “ballots will continue to be accepted and processed as they are presented to us and we will deliver them to their intended destination.” 
Lawyers for the USPS said in a court filing on Wednesday that postal workers were instructed to run continuous sweeps of their facilities on Election Day and get ballots to their destination by a state’s cutoff time.
“This is super frustrating,” NAACP attorney Allison Zieve told the Washington Post on Tuesday. “If they get all the sweeps done today in time, it doesn’t matter if they flouted the judge’s order. They say here they will get the sweeps done between 4 pm and 8 pm, but 8 pm is too late, and in some states, 5 pm is too late.”
What’s clear is that the 300,000 figure is likely unreliable at best, and perhaps a vast overstatement at worst. What’s still unclear is whether any ballots at all did not make it from a postal facility to a ballot-counting center on time — and it’s not certain that there will be an answer. But there is hope, based on Bray’s testimony on Wednesday, that the USPS will provide more clarity soon.
  
  
  
    Will you help keep Vox free for all?
  
  
    Millions of people rely on Vox to understand how the policy decisions made in Washington, from health care to unemployment to housing, could impact their lives. Our work is well-sourced, research-driven, and in-depth. And that kind of work takes resources. Even after the economy recovers, advertising alone will never be enough to support it. If you have already made a contribution to Vox, thank you. If you haven’t, help us keep our journalism free for everyone by making a financial contribution today, from as little as $3.",,,,,
Live results for California’s Proposition 22 on ride-hailing drivers,"UPDATE: California voters passed Proposition 22, which means that ride-hailing companies like Uber and Lyft can consider drivers independent contractors, not employees.The future of the so-called gig economy is in the hands of California voters deciding on Proposition 22, the latest development in an ongoing fight over whether app-based drivers should be considered independent contractors or employees. 
The proposition, which has the support of a pricey campaign funded by companies like Uber and Lyft, would allow these companies to continue to classify their drivers as independent contractors, while providing some limited benefits and protections. Classifying drivers in this way has kept costs lower for these services, and been central to their business model. 
But critics of these firms — including a movement made up of drivers who want the right to unionize — argue that the work these gig workers do makes them employees, and that they deserve protections given to employees, like overtime pay and paid leave. 
Proposition 22 isn’t the first time California has considered the employee-independent contractor question. Last year, the state approved a law called AB 5, which created new standards for classifying people as independent contractors that built on a previous ruling from the state’s Supreme Court. But companies like Uber and Lyft have not complied, inviting a court case from state officials. The companies hoped to win that case, so that their delivery and ride-hailing apps would be able to maintain business as usual. 
But they’ve had no such luck. In a recent decision, a California appeals court reaffirmed that yes, ride-hailing drivers ought to be considered employees. That means that Proposition 22  could potentially be these companies’ last chance to protect their businesses as they know them. But if Proposition 22 succeeds, it could also spell defeat for ride-hailing drivers who are demanding better protections and pay. 
California Proposition 22
A yes vote would mean ride-hailing companies can consider drivers independent contractors who are not entitled to the same benefits as employees.
A no vote would mean ride-hailing drivers should be considered employees, and given additional benefits and protections.




(function() {
  var eles = document.querySelectorAll('[data-iframe]')
  for ( var i = 0; i < eles.length; i++ ) {
	var ele = eles[i]
	if ( ele.getAttribute('data-iframe-loaded') == 'true' ) continue
	var src = ele.getAttribute('data-iframe')
	var iframe = document.createElement('IFRAME')
	iframe.src = src
	iframe.width = '100%'
	ele.appendChild(iframe)
	ele.setAttribute('data-iframe-loaded', 'true')
	var handleSizingResponse = function(e) {
  	if (iframe.contentWindow != e.source) return;
  	if (!e.data || e.data.type != 'embed-size') return;
  	iframe.setAttribute('height', e.data.height)
	}
	window.addEventListener('message', handleSizingResponse, false);
  }
})();



  
  
  
    Will you help keep Vox free for all?
  
  
    Millions of people rely on Vox to understand how the policy decisions made in Washington, from health care to unemployment to housing, could impact their lives. Our work is well-sourced, research-driven, and in-depth. And that kind of work takes resources. Even after the economy recovers, advertising alone will never be enough to support it. If you have already made a contribution to Vox, thank you. If you haven’t, help us keep our journalism free for everyone by making a financial contribution today, from as little as $3.",,,,,
Live results for California’s data privacy ballot initiative ,"UPDATE: California passed ballot measure Proposition 24, strengthening its digital privacy protections.California has the toughest — and one of the only — consumer data privacy laws in the US: the California Consumer Privacy Act (CCPA). And a ballot measure called the California Privacy Rights and Enforcement Act, or Proposition 24, may make it even stronger.
As of Wednesday, at 12:50 am ET, more than 55 percent of ballots were cast in support of the measure, with more than 64 percent of the vote reported, according to Vox’s partners at Decision Desk. 
The CCPA gave Californians a measure of control over how their personal data was collected, accessed, and sold. But it contained some loopholes businesses have used to get around the restrictions imposed by the law — loopholes Proposition 24 would close by giving extra protection to data about “sensitive” areas including race, health, religion, biometric information, and precise location. The proposition would also establish and fund a new state agency to enforce the law, a duty currently left to the underresourced attorney general’s office.
Also, Proposition 24 may be the first California ballot measure to get its own rap:

Proposition 24 has some surprising pro-privacy opponents. The Electronic Frontier Foundation, which advocates for digital civil rights, doesn’t support it (it doesn’t oppose it, either, calling the law a “mixed bag of partial steps forwards and backwards”) and the American Civil Liberties Union is firmly against it. One big reason: The initiative would allow businesses to charge users who opt out of having their data sold or shared more, making privacy rights less accessible to people with lower incomes.
One thing the proposition’s supporters and opponents seem to agree on is that CCPA was a good first step, but a law with a lot of room for improvement. Now we’ll find out what a second step might look like.
California Proposition 24
A yes vote would close some loopholes in California’s data privacy law. It would also establish and fund a new state agency to enforce privacy law.
A no vote would mean no extra protections would be added to California’s data privacy law.




(function() {
  var eles = document.querySelectorAll('[data-iframe]')
  for ( var i = 0; i < eles.length; i++ ) {
	var ele = eles[i]
	if ( ele.getAttribute('data-iframe-loaded') == 'true' ) continue
	var src = ele.getAttribute('data-iframe')
	var iframe = document.createElement('IFRAME')
	iframe.src = src
	iframe.width = '100%'
	ele.appendChild(iframe)
	ele.setAttribute('data-iframe-loaded', 'true')
	var handleSizingResponse = function(e) {
  	if (iframe.contentWindow != e.source) return;
  	if (!e.data || e.data.type != 'embed-size') return;
  	iframe.setAttribute('height', e.data.height)
	}
	window.addEventListener('message', handleSizingResponse, false);
  }
})();



  
  
  
    Will you help keep Vox free for all?
  
  
    Millions of people rely on Vox to understand how the policy decisions made in Washington, from health care to unemployment to housing, could impact their lives. Our work is well-sourced, research-driven, and in-depth. And that kind of work takes resources. Even after the economy recovers, advertising alone will never be enough to support it. If you have already made a contribution to Vox, thank you. If you haven’t, help us keep our journalism free for everyone by making a financial contribution today, from as little as $3.",,,,,
